{
  "$schema": "https://json-schema.org/draft/2020-12/schema",
  "$id": "https://aiconnai.github.io/engram/schemas/evidence-v1.schema.json",
  "title": "Engram Harness Evidence Receipt v1",
  "description": "Schema for revision-bound evidence receipts generated by trusted execution in the Engram harness.",
  "type": "object",
  "required": [
    "schema_version",
    "timestamp",
    "commit_sha",
    "checks",
    "verdict",
    "sha256_manifest"
  ],
  "additionalProperties": false,
  "properties": {
    "schema_version": {
      "description": "Schema version identifier for the evidence receipt.",
      "type": "string",
      "const": "evidence-v1"
    },
    "timestamp": {
      "description": "UTC RFC 3339 timestamp when evidence was collected, ending with Z.",
      "type": "string",
      "pattern": "^[0-9]{4}-[0-9]{2}-[0-9]{2}T[0-9]{2}:[0-9]{2}:[0-9]{2}(?:\\.[0-9]+)?Z$"
    },
    "commit_sha": {
      "description": "Target Git commit SHA (40-character lowercase hexadecimal).",
      "type": "string",
      "pattern": "^[0-9a-f]{40}$"
    },
    "task_id": {
      "description": "Optional task identifier corresponding to the executed task specification.",
      "type": "string",
      "pattern": "^[a-zA-Z0-9_-]+$",
      "minLength": 1,
      "maxLength": 128
    },
    "base_sha": {
      "description": "Base Git commit SHA (40-character lowercase hexadecimal).",
      "type": "string",
      "pattern": "^[0-9a-f]{40}$"
    },
    "tree_sha": {
      "description": "Git tree SHA for the verified worktree state.",
      "type": "string",
      "pattern": "^[0-9a-f]{40}$"
    },
    "verdict": {
      "description": "Overall verdict of the execution run.",
      "type": "string",
      "enum": [
        "pass",
        "fail",
        "warn",
        "PASS",
        "FAIL",
        "WARN"
      ]
    },
    "checks": {
      "description": "List of individual check execution results.",
      "type": "array",
      "items": {
        "type": "object",
        "required": [
          "id",
          "status"
        ],
        "additionalProperties": false,
        "properties": {
          "id": {
            "description": "Unique check identifier.",
            "type": "string",
            "minLength": 1,
            "pattern": "^[a-zA-Z0-9_:.-]+$"
          },
          "status": {
            "description": "Execution status of the check.",
            "type": "string",
            "enum": [
              "pass",
              "fail",
              "warn",
              "skipped"
            ]
          },
          "exit_code": {
            "description": "Exit code returned by the check command.",
            "type": "integer"
          },
          "duration_ms": {
            "description": "Duration of check execution in milliseconds.",
            "type": "integer",
            "minimum": 0
          },
          "message": {
            "description": "Short human-readable summary of check result.",
            "type": "string"
          },
          "command": {
            "description": "Command label or approved argv representation.",
            "type": "string"
          },
          "log_hash": {
            "description": "SHA-256 hash of the full command execution log.",
            "type": "string",
            "pattern": "^[0-9a-f]{64}$"
          }
        }
      },
      "minItems": 1
    },
    "sha256_manifest": {
      "description": "Map of repo-relative paths to their verified SHA-256 digest.",
      "type": "object",
      "additionalProperties": {
        "type": "string",
        "pattern": "^[0-9a-f]{64}$"
      },
      "propertyNames": {
        "pattern": "^(?!/)(?!.*(?:^|/)\\.\\.(?:/|$))[a-zA-Z0-9_./-]+$"
      }
    },
    "recorder": {
      "description": "Identity of the trusted evidence recorder.",
      "type": "string",
      "minLength": 1
    },
    "toolchain": {
      "description": "Toolchain version information.",
      "type": "string"
    },
    "environment": {
      "description": "Sanitized runtime environment metadata.",
      "type": "object"
    }
  }
}
